pk,jsondata,id,name,description,markup_description
272,"{""vdoc"": ""N==no||AFF==affix||CLI==clitic||PAR==particle||AUX==auxiliary||STEM==stem change/ suppletion||?==unknown||REP==repetition of (parts of) the verb""}",TAME3-3,Is anterior marked morpho-syntactically?,expressing continuous present relevance of a past situation,
273,"{""vdoc"": ""N==no||AFF==affix||CLI==clitic||PAR==particle||AUX==auxiliary||STEM==stem change/ suppletion||?==unknown""}",TAME3-1,Is perfective marked morpho-syntactically?,a situation is seen as a single whole,
274,"{""vdoc"": ""N==no||AFF==affix||CLI==clitic||PAR==particle||AUX==auxiliary||STEM==stem change/ suppletion||?==unknown||REP==repetition of (parts of) the verb""}",TAME3-8,Is an incompletive action marked morpho-syntactically?,"i.e. focussing on a situation that is unfinished, ongoing/in opposition to the completive",
275,"{""vdoc"": ""N==no||AFF==affix||CLI==clitic||PAR==particle||AUX==auxiliary||STEM==stem change/ suppletion||?==unknown""}",TAME4-1,Is firsthand information marked morpho-syntactically?,i.e. sth directly experienced through the senses,
276,"{""vdoc"": ""N==no||AFF==affix||CLI==clitic||PAR==particle||AUX==auxiliary||STEM==stem change/ suppletion||?==unknown""}",TAME4-3,Is secondhand information marked morpho-syntactically (may include third-hand information)?,"i.e. reportative, includes hearsay",
522,"{""vdoc"": ""0==No||1==Yes""}",ARW4-1-08,Can negation be marked clause-initially?,Don't include elliptical 'Not Mary',
277,"{""vdoc"": ""N==no||AFF==affix||CLI==clitic||PAR==particle||AUX==auxiliary||STEM==stem change/ suppletion||?==unknown""}",TAME4-2,Is non-firsthand information marked morpho-syntactically?,one marker for everything not directly witnessed,
278,"{""vdoc"": ""N==no||AFF==affix||CLI==clitic||PAR==particle||AUX==auxiliary||STEM==stem change/ suppletion||?==unknown""}",TAME4-5,Is visual evidentiality marked morpho-syntactically?,sth seen only,
279,"{""vdoc"": ""N==no||AFF==affix||CLI==clitic||PAR==particle||AUX==auxiliary||STEM==stem change/ suppletion||?==unknown""}",TAME4-4,Is quotative marked morpho-syntactically?,i.e. a report with exact indication of who said it,
280,"{""vdoc"": ""0==No||1==Yes""}",ARW29,There is an open class of adjectives,,
281,"{""vdoc"": ""0==No||1==Yes""}",ARW28,There is a causative suffix,,
282,"{""vdoc"": ""0==No||1==Yes""}",ARW27,There is a causative prefix,,
283,"{""vdoc"": ""0==No||1==Yes""}",ARW26,"The language is mostly suffixing, with only a few prefixes",,
284,"{""vdoc"": ""0==No||1==Yes""}",ARW25,Feminine gender is the default gender,,
285,"{""vdoc"": ""0==No||1==Yes""}",ARW24,"Roots are mostly disyllabic, but a few are monsyllabic",,
286,"{""vdoc"": ""0==No||1==Yes""}",ARW23,"Suffixes are mostly monosyllabic, but a few are disyllabic",,
287,"{""vdoc"": ""0==No||1==Yes""}",ARW22,Prefixes are generally monosyllabic,,
288,"{""vdoc"": ""0==No||1==Yes""}",ARW21,There is labialization of consonants,,
289,"{""vdoc"": ""0==No||1==Yes""}",ARW20,There is final vowel elision (word- or syllable-finally),,
290,"{""vdoc"": ""A==adv-A||B==A-adv||C==language has other means to mark degree""}",NP160,What is the most frequent order of adjective and degree word?,,
291,"{""vdoc"": ""1==true||0==false""}",ARGEX12-1,Anticausative constructions are marked with verbal morphology,,
292,"{""vdoc"": ""0==No||1==Yes""}",ARW2-9-04,Are there postpositions?,,
293,"{""vdoc"": ""1==yes||0==no||N/A==not applicable""}",NP223,Is there agreement in PHYSICAL PROPERTIES between numeral and noun?,,
294,"{""vdoc"": ""1==yes||0==no||N/A==not applicable""}",NP222,Is there agreement in GENDER between numeral and noun?,,
295,"{""vdoc"": ""1==yes||0==no||N/A==not applicable""}",NP221,Is there agreement in NUMBER between numeral and noun?,,
296,"{""vdoc"": ""1==yes||0==no||N/A==not applicable""}",NP220,Is there agreement between numeral and the noun in the NP?,,
297,"{""vdoc"": ""0==No||1==Yes""}",ICU39,Is a polar question indicated by verbal morphology?,"Corresponds to WALS feature number: 116 [http://wals.info], Constenla feature number: na [Constenla Umaña, Adolfo. (1991) Las lenguas del área intermedia: introducción a su estudio areal. San José: Universidad de Costa Rica.]",
298,"{""vdoc"": ""0==No||1==Yes""}",ICU38,Is a polar question indicated by a question particle?,"Corresponds to WALS feature number: 116 [http://wals.info], Constenla feature number: na [Constenla Umaña, Adolfo. (1991) Las lenguas del área intermedia: introducción a su estudio areal. San José: Universidad de Costa Rica.]",
299,"{""vdoc"": ""A==obligatory||B==variable||C==not expressed""}",ARGEX2-4-1,Verbal person markings for A when lexical argument is realized within clause are,,
300,"{""vdoc"": ""0==No||1==Yes""}",ICU31,Does the perfect marker come from 'finish' or 'already'?,"Corresponds to WALS feature number: 68 [http://wals.info], Constenla feature number: na [Constenla Umaña, Adolfo. (1991) Las lenguas del área intermedia: introducción a su estudio areal. San José: Universidad de Costa Rica.]",
301,"{""vdoc"": ""0==No||1==Yes""}",ICU30,Does the language mark the perfect?,"Corresponds to WALS feature number: 68 [http://wals.info], Constenla feature number: na [Constenla Umaña, Adolfo. (1991) Las lenguas del área intermedia: introducción a su estudio areal. San José: Universidad de Costa Rica.]",
302,"{""vdoc"": ""0==No||1==Yes""}",ICU33,Is there a morphologically dedicated second person imperative that does not distinguish between singular and plural?,"Corresponds to WALS feature number: 70 [http://wals.info], Constenla feature number: na [Constenla Umaña, Adolfo. (1991) Las lenguas del área intermedia: introducción a su estudio areal. San José: Universidad de Costa Rica.]",
303,"{""vdoc"": ""0==No||1==Yes""}",ICU32,Is there a morphologically dedicated second singular as well as second plural imperative?,"Corresponds to WALS feature number: 70 [http://wals.info], Constenla feature number: na [Constenla Umaña, Adolfo. (1991) Las lenguas del área intermedia: introducción a su estudio areal. San José: Universidad de Costa Rica.]",
304,"{""vdoc"": ""0==No||1==Yes""}",ICU35,Is the prohibitive expressed with a special imperative (not the normal 2S imperative)?,"Corresponds to WALS feature number: 71 [http://wals.info], Constenla feature number: na [Constenla Umaña, Adolfo. (1991) Las lenguas del área intermedia: introducción a su estudio areal. San José: Universidad de Costa Rica.]",
305,"{""vdoc"": ""0==No||1==Yes""}",ICU34,Is the prohibitive expressed with a special negative marker (not found in declaratives)?,"Corresponds to WALS feature number: 71 [http://wals.info], Constenla feature number: na [Constenla Umaña, Adolfo. (1991) Las lenguas del área intermedia: introducción a su estudio areal. San José: Universidad de Costa Rica.]",
306,"{""vdoc"": ""0==No||1==Yes""}",ICU37,Are evidentials marked with a separate particle?,"Corresponds to WALS feature number: 78 [http://wals.info], Constenla feature number: na [Constenla Umaña, Adolfo. (1991) Las lenguas del área intermedia: introducción a su estudio areal. San José: Universidad de Costa Rica.]",
410,"{""vdoc"": ""0==No||1==Yes""}",ARW2-6-01,Are there possessive classes?,(i.e. different nouns treated differently in possession according to semantically-based groupings. Include alienable/inalienable.),
307,"{""vdoc"": ""0==No||1==Yes""}",ICU36,Are evidentials marked on the verb as an affix or clitic?,"Corresponds to WALS feature number: 78 [http://wals.info], Constenla feature number: na [Constenla Umaña, Adolfo. (1991) Las lenguas del área intermedia: introducción a su estudio areal. San José: Universidad de Costa Rica.]",
308,"{""vdoc"": ""A==independent prefix/proclitic||B==independent suffix/enclitic||C==fused with person||D==none""}",ARGEX2-5,Number can be marked for A,,
309,"{""vdoc"": ""Y==yes||N==no||?==not known""}",FFQ4,Palatal nasal (phonemic),,
310,"{""vdoc"": ""1==true||0==false""}",ARGEX3-1-2,Referential arguments in inverse constructions are treated with a marker set distinct from that used to index the referential argument in direct constructions,,
311,"{""vdoc"": ""0==No||1==Yes""}",ARW4-1-10,Are verbal and non-verbal predicates marked by the same negator?,,
312,"{""vdoc"": ""0==No||1==Yes""}",ARW4-3-05a,"Are there relative clauses, i.e. embedded construction by which a clause modifies a head N?","This excludes paratactic constructions such as 'correlative clauses', i.e. 'the man went away. The man killed the pig' translatable as 'The man who killed the pig went away'.",
313,"{""vdoc"": ""1==true||0==false""}",ARGEX7-1-1,Applicative constructions only select benefactive/malefactive participants,,
314,"{""vdoc"": ""0==No||1==Yes""}",ICS28,Is the order of the adjective and the noun A - N?,"Corresponds to WALS feature number: 87 [http://wals.info], Constenla feature number: 9 [Constenla Umaña, Adolfo. (1991) Las lenguas del área intermedia: introducción a su estudio areal. San José: Universidad de Costa Rica.]",
315,"{""vdoc"": ""0==No||1==Yes""}",ICS29,Is the order is numerals with respect to the indefinite nominal phrase  Num - N?,"Corresponds to WALS feature number: 89 [http://wals.info], Constenla feature number: 11 [Constenla Umaña, Adolfo. (1991) Las lenguas del área intermedia: introducción a su estudio areal. San José: Universidad de Costa Rica.]",
316,"{""vdoc"": ""0==No||1==Yes""}",ICS24,Is nominal plurality marked with an affix or clitic?,"Corresponds to WALS feature number: 33 [http://wals.info], Constenla feature number: na [Constenla Umaña, Adolfo. (1991) Las lenguas del área intermedia: introducción a su estudio areal. San José: Universidad de Costa Rica.]",
317,"{""vdoc"": ""0==No||1==Yes""}",ICS25,Is the order of adpositions and nouns as follows: noun - postposition or noun - case suffixes?,"Corresponds to WALS feature number: 85 [http://wals.info], Constenla feature number: 6 [Constenla Umaña, Adolfo. (1991) Las lenguas del área intermedia: introducción a su estudio areal. San José: Universidad de Costa Rica.]",
318,"{""vdoc"": ""0==No||1==Yes""}",ICS26,Is the order of the noun that is possessed and the noun that indicates the posessor (the genitive) N-Gen?,"Corresponds to WALS feature number: 86 [http://wals.info], Constenla feature number: 7 [Constenla Umaña, Adolfo. (1991) Las lenguas del área intermedia: introducción a su estudio areal. San José: Universidad de Costa Rica.]",
319,"{""vdoc"": ""0==No||1==Yes""}",ICS27,Is the order of the noun that is possessed and the noun that indicates the posessor (the genitive) Gen - N?,"Corresponds to WALS feature number: 86 [http://wals.info], Constenla feature number: 8 [Constenla Umaña, Adolfo. (1991) Las lenguas del área intermedia: introducción a su estudio areal. San José: Universidad de Costa Rica.]",
320,"{""vdoc"": ""0==No||1==Yes""}",ICS20,Is there VS (S may be agent or object) order in intransitive sentences?,"Corresponds to WALS feature number: 82 [http://wals.info], Constenla feature number: 4 [Constenla Umaña, Adolfo. (1991) Las lenguas del área intermedia: introducción a su estudio areal. San José: Universidad de Costa Rica.]",
321,"{""vdoc"": ""0==No||1==Yes""}",ICS21,Does the language have case prefixes or prepositional clitics?,"Corresponds to WALS feature number: 51 [http://wals.info], Constenla feature number: 5 [Constenla Umaña, Adolfo. (1991) Las lenguas del área intermedia: introducción a su estudio areal. San José: Universidad de Costa Rica.]",
322,"{""vdoc"": ""0==No||1==Yes""}",ICS22,Does the language have case suffixes or postpositional clitics?,"Corresponds to WALS feature number: 51 [http://wals.info], Constenla feature number: 6 [Constenla Umaña, Adolfo. (1991) Las lenguas del área intermedia: introducción a su estudio areal. San José: Universidad de Costa Rica.]",
323,"{""vdoc"": ""0==No||1==Yes""}",ICS23,Is the basic order of constituents SOV?,"Corresponds to WALS feature number: 81 [http://wals.info], Constenla feature number: na [Constenla Umaña, Adolfo. (1991) Las lenguas del área intermedia: introducción a su estudio areal. San José: Universidad de Costa Rica.]",
324,"{""vdoc"": ""1==true||0==false""}",ARGEX7-1-2,Applicative constructions can only select animate arguments,,
325,"{""vdoc"": ""A==no adpositions||B==prepositions||C==postpositions||D==both prepositions and postpositions with none being dominant||E==prefixes||F==suffixes||G==circumfixes""}",NP901,What kind of adposition type is most dominant?,expressing spatial relations,
326,"{""vdoc"": ""Y==yes||N==no||?==not known""}",FFQ23,Ideophones (as a clear separate word class),,
327,"{""vdoc"": ""A==obligatory||B==optional||C==none""}",ARGEX11-3,Language has independent reciprocal pronouns,,
328,"{""vdoc"": ""1==true||0==false""}",ARGEX11-2,Reciprocal constructions are marked with a specialized particle,,
329,"{""vdoc"": ""1==true||0==false""}",ARGEX11-1,Reciprocal constructions are marked with verbal morphology,,
330,"{""vdoc"": ""1==true||0==false""}",ARGEX11-4,Marking for reciprocals and reflexives is morphologically conflated,,
331,"{""vdoc"": ""A==obligatory||B==variable||C==not expressed""}",ARGEX2-7-1,Verbal person markings for P when lexical argument is realized within clause are,,
332,"{""vdoc"": ""0==No||1==Yes""}",ARW1-2-03a,Are there consonant clusters (not counting prenasalized consonants) in syllable onset?,,
411,"{""vdoc"": ""0==No||1==Yes""}",ARW2-6-03,Are there different possessive constructions?,,
333,"{""vdoc"": ""A==no||B==realized as prefixes||C==realized as suffixes||D==realized as free morphemes||E==realization depends on deictic form""}",NP836,Are there classifiers used with deictic elements?,"e.g. with demonstratives, articles. By a classifying morpheme is meant a free or bound morpheme which is a noun categorisation device, the choice of which is determined by lexical selection.",
334,"{""vdoc"": ""1==yes||0==no""}",NP837,Are there classifiers used with verbal predicates?,,
335,"{""vdoc"": ""1==yes||0==no""}",NP834,Are there classifiers used with descriptive modifiers?,,
336,"{""vdoc"": ""A==no||B==realized as prefixes||C==realized as suffixes||D==realized as free morphemes||E==realization depends on (pro)noun""}",NP835,Are there classifiers used in possessive constructions?,"e.g. [1SG-CLF:LIQUID honey] 'my honey'. By a classifying morpheme is meant a free or bound morpheme which is a noun categorisation device, the choice of which is determined by lexical selection. Indicate in the comments field whether the genitive classifiers categorize (a) the possessed noun; (b) the possessor; (c) the relation between possessor and possessed.",
337,"{""vdoc"": ""A==no||B==yes, realized as prefixes||C==yes, realized as suffixes||D==realized as free morphemes||E==yes, realization depends on noun""}",NP832,Are there classifiers used with nouns?,"e.g. [snake CLF:AN] 'snake'. By a classifying morpheme is meant a free or bound morpheme which is a noun categorisation device, the choice of which is determined by lexical selection.",
338,"{""vdoc"": ""1==yes||0==no""}",NP833,Are there classifiers used with interrogative pronouns?,,
339,"{""vdoc"": ""1==yes||0==no""}",NP830,Are there classifiers?,"By a classifier is meant a free or bound morpheme which is a noun categorisation device, the choice of which is determined by lexical selection.",
340,"{""vdoc"": ""A==no||B==realized as prefixes||C==realized as suffixes||D==realized as circumfixes||E==realized as free morphemes||F==realization depends on numeral""}",NP831,Are there classifiers used with numerals?,"e.g. [three-CLF:HUM teacher] 'three teachers'. By a classifying morpheme is meant a free or bound morpheme which is a noun categorisation device, the choice of which is determined by lexical selection.",
341,"{""vdoc"": ""A==AN||B==variable||C==NA""}",FFQ21,Basic AN order,,
342,"{""vdoc"": ""1==yes||0==no""}",NP838,Do classifiers have a derivational function?,,
343,"{""vdoc"": ""1==yes||0==no""}",NP839,Do classifiers have an anaphoric function?,,
344,"{""vdoc"": ""0==No||1==Yes""}",ARW2-4-07,Can singular number be marked on the noun itself?,number-marking on N does not count phrase-level clitic or reduplication absence of plural marking does NOT count as singular marking,
345,"{""vdoc"": ""0==No||1==Yes""}",ARW2-4-05,Are there nouns which are suppletive for number?,Only answer yes if present for more than 2 (basic) kin terms,
346,"{""vdoc"": ""0==No||1==Yes""}",ARW2-4-03,Are there declensions (partly) determined by gender of the noun?,,
347,"{""vdoc"": ""0==No||1==Yes""}",ARW2-4-02,Are there declensions (partly) determined by number of the noun?,(By noun declensions is meant e.g. nouns divided into groups which act differently in terms of morphological marking. Do not include place names which can act as bare adjuncts.),
348,"{""vdoc"": ""A==no||B==yes, subject markers||C==yes, object markers||D==split system""}",NP409,"Can pronominal possessors (pronoun, affix, clitic) be related to main tense verbal person markers (pronoun, affix, clitic)",,
349,"{""vdoc"": ""1==yes||0==no""}",NP408,Does the language have a separate form for 3rd person possessive reflexive? Cf. example,In this way the language distinguishes: 'the mani brings hisi children to school' versus  'the mani brings hisj children to school' (bound versus free pronouns),
350,"{""vdoc"": ""1==yes||0==no""}",NP407,"Is a word/morpheme meaning 'pet' (or similar) required in possessive constructions involving nouns which denote (domesticated) animals, and/or food?",,
351,"{""vdoc"": ""1==yes||0==no||N/A==not applicable""}",NP406,Do possessive constructions with optionally possessed nouns differ from those with obligatorily possessed nouns? (= is alienable and inalienable possession formally distinguished?),within adnominal modification!,
352,"{""vdoc"": ""1==yes||0==no""}",NP405,Are there nouns denoting obligatorily possessed items?,,
353,"{""vdoc"": ""A==no||B==yes: (POSR) pers.pos.pref-POSSD||C==yes: (POSR) POSSD-pers.pos.suf/clitic||D==yes: (POSR) pers.pos.pref-POSSD-possessed||E==yes: (POSR) pers.pos.pref-rlt-POSSD||F==yes: (POSR) POSSD-possessed||G==yes: pers.pos.pref-classifier POSSD""}",NP404,"In possessive constructions with a pronominal possessor, is the POSSESSED noun usually marked? (state most frequent construction; NB: if marking depends on alienability, state marking of possessor in ALIENABLE constructions)","Terminology: pers.pos.pref/suf = personal possessive prefix or suffix is an affix which encodes person, number and/or gender of a possessor and which appears on the possessed noun. Possessed = refers to a free or bound form which indicates that an item is possessed and morphosyntactically associated with a noun denoting the possessed entity. NB: word order of possessor vs. possessed is symbolic, and is specified in a separate section!",
354,"{""vdoc"": ""A==no||B==yes: possessive.pronoun POSSD||C==yes: personal.pronoun-pos.marker POSSD||D==yes: personal.pronoun-agr/w/posd POSSD""}",NP403,"In possessive constructions with a pronominal possessor, is the POSSESSOR usually marked? (state most frequent construction; NB: if marking depends on alienability, state marking of possessor in ALIENABLE constructions)","Terminology: pos.marker = possessive marker which is a free or bound form which indicates possession. NB: word order of possessor vs. possessed is symbolic, and is specified in a separate section!",
355,"{""vdoc"": ""A==rel-N||B==N-rel||C==both orders with neither order dominant||D==both but for specific relative clauses""}",NP150,What is the most frequent order of relative clause and noun?,,
412,"{""vdoc"": ""0==No||1==Yes""}",ARW2-6-02,Is alienable/inalienable a relevant distinction?,,
413,"{""vdoc"": ""1==-yki||2==-q||3==none""}",AND24,What is the form of 1sg>2sgPRES?,,
356,"{""vdoc"": ""A==no||B==yes: POSR-pos.marker POSSD||C==yes: POSR pos.marker POSSD||D==yes: POSR-agr/w/posd POSSD""}",NP401,"In possessive constructions with a nominal possessor, is the POSSESSOR usually marked? (state most frequent construction; NB: if marking depends on alienability, state marking of possessor in ALIENABLE constructions)","Terminology: pos.marker = possessive marker which is a free or bound form which indicates possession, and which is morphosyntactically associated with a noun denoting possessor. Pers.pos.pref/suf = personal possessive prefix or suffix, is an affix which encodes person, number and/or gender of a possessor and which appears on the possessed noun.  NB: word order of possessor vs. possessed is symbolic, and is specified in a separate section!",
357,"{""vdoc"": ""0==No||1==Yes""}",ARW2-4-08,Can dual number be marked on the noun itself?,number-marking on N does not count phrase-level clitic or reduplication,
358,"{""vdoc"": ""0==No||1==Yes""}",ARW1-1-03b,Is there contrast between heterorganic and homorganic sequence of nasal and velar stop?,"For example, does the language permit a phonetic contrast between -nk- and -ŋk- clusters",
359,"{""vdoc"": ""0==No||1==Yes""}",ARW1-1-03a,Are there as many points of articulation for nasals as there are for stops?,Only consider points of articulation where a nasal is phonetically possible,
360,"{""vdoc"": ""0==No||1==Yes""}",ARW2-7-03b,Is there a minimal counting system or no clear number altogether?,"(e.g. one, two, (2+1=3), many)",
361,"{""vdoc"": ""0==No||1==Yes""}",ARW2-7-03a,Is there a body-part tallying system?,,
362,"{""vdoc"": ""0==No||1==Yes""}",ICS5,Is there a rounding contrast for non-front (central or back) vowels of the same height?,"Corresponds to WALS feature number: 11 [http://wals.info], Constenla feature number: 45 [Constenla Umaña, Adolfo. (1991) Las lenguas del área intermedia: introducción a su estudio areal. San José: Universidad de Costa Rica.]",
363,"{""vdoc"": ""0==No||1==Yes""}",ICS4,Is there a nasality contrast for vowels?,"Corresponds to WALS feature number: 10 [http://wals.info], Constenla feature number: 47 [Constenla Umaña, Adolfo. (1991) Las lenguas del área intermedia: introducción a su estudio areal. San José: Universidad de Costa Rica.]",
364,"{""vdoc"": ""0==No||1==Yes""}",ICS7,"Does the language lack bilabials, fricatives, or nasals?","Corresponds to WALS feature number: 18 [http://wals.info], Constenla feature number: na [Constenla Umaña, Adolfo. (1991) Las lenguas del área intermedia: introducción a su estudio areal. San José: Universidad de Costa Rica.]",
365,"{""vdoc"": ""0==No||1==Yes""}",ARW3-4-03,"Can recipients be treated as a transitive object, i.e. as Direct object?",,
366,"{""vdoc"": ""0==No||1==Yes""}",ICS1,Is there one or more uvular occlusive phoneme?,"Corresponds to WALS feature number: 6 [http://wals.info], Constenla feature number: 56 [Constenla Umaña, Adolfo. (1991) Las lenguas del área intermedia: introducción a su estudio areal. San José: Universidad de Costa Rica.]",
367,"{""vdoc"": ""N==no||AFF==affix||CLI==clitic||PAR==particle||AUX==auxiliary||STEM==stem change/ suppletion||?==unknown""}",TAME4-7,Is assumed evidentiality marked morpho-syntactically?,conclusion drawn on the basis of logical conclusion and general knowledge,
368,"{""vdoc"": ""0==No||1==Yes""}",ICS3,Is there a velar nasal phoneme /ij/?,"Corresponds to WALS feature number: 9 [http://wals.info], Constenla feature number: 74 [Constenla Umaña, Adolfo. (1991) Las lenguas del área intermedia: introducción a su estudio areal. San José: Universidad de Costa Rica.]",
369,"{""vdoc"": ""0==No||1==Yes""}",ICS2,Is there a non-labial glottalized occlusive?,"Corresponds to WALS feature number: 7 [http://wals.info], Constenla feature number: 50, 51, 62 [Constenla Umaña, Adolfo. (1991) Las lenguas del área intermedia: introducción a su estudio areal. San José: Universidad de Costa Rica.]",
370,"{""vdoc"": ""N==no||AFF==affix||CLI==clitic||PAR==particle||AUX==auxiliary||STEM==stem change/ suppletion||?==unknown""}",TAME4-6,Is inferred evidentiality marked morpho-syntactically?,conclusion drawn on the basis of sensory input,
371,"{""vdoc"": ""0==No||1==Yes""}",ICS9,Is there a distinction between inclusive and exclusive for personal pronouns?,"Corresponds to WALS feature number: 39 [http://wals.info], Constenla feature number: 17 [Constenla Umaña, Adolfo. (1991) Las lenguas del área intermedia: introducción a su estudio areal. San José: Universidad de Costa Rica.]",
372,"{""vdoc"": ""0==No||1==Yes""}",ICS8,Is there an opposition between masculine and feminine personal pronouns?,"Corresponds to WALS feature number: 44 [http://wals.info], Constenla feature number: 18 [Constenla Umaña, Adolfo. (1991) Las lenguas del área intermedia: introducción a su estudio areal. San José: Universidad de Costa Rica.]",
373,"{""vdoc"": ""Y==yes||N==no||?==not known""}",FFQ22,Numerals >9 (non-Spanish/Portuguese),,
374,"{""vdoc"": ""0==No||1==Yes""}",ARW4-2a-04,Is there an Actor voice contrasted with one or more Undergoer voices?,,
375,"{""vdoc"": ""A==num-N||B==N-num||C==both orders with neither order dominant||D==both but for specific forms||E==both but depend on the characteristics of the nominal head||F==neither, numerals are not used adnominally""}",NP120,What is the most frequent order of numeral and noun?,,
376,"{""vdoc"": ""Y==yes||N==no||?==not known""}",FFQ20,O before A basic constituent order,,
377,"{""vdoc"": ""A==no||B==numeral 'one' is used as an indefinite article||C==indefinite article in use distinct in realization from numeral for 'one'""}",NP301,Are there indefinite articles in use?,"“A morpheme is considered here to be an indefinite article if it accompanies a noun and signals that the noun phrase is pragmatically indefinite in the sense that it denotes something not known to the hearer” (Dryer, WALS, Ch.37)",
