pk,jsondata,id,name,description,markup_description
378,"{""vdoc"": ""A==no||B==one of the demonstratives is used as a marker of definiteness||C==definiteness marker distinct in realization from a demonstrative||D==both demonstrative and a different definiteness marker in use with neither being dominant""}",NP302,Are there definite articles in use?,"A definite article is defined as “a morpheme which accompanies nouns and which codes definiteness or specificity” (Dryer, WALS, Ch.38)",
379,"{""vdoc"": ""A==unrelated||B==related to proximate form of the demonstrative||C==related to medial form||D==related to distal form||E==3rd person pronouns are indicated by demonstratives""}",NP303,Are third person pronouns and demonstratives related?,derivational relationship is meant,
380,"{""vdoc"": ""A==DOS||B==POS||C==no distance constrast||N/A==not applicable""}",NP304,What system of demonstratives is present in the language? (distance-oriented system vs. person-oriented system),"A language is considered to have a distance-oriented system (DOS), if the middle term “refers to a location in medial distance relative to a deictic center”. In languages with a person-oriented system (POS), the middle term “denotes a referent close to the hearer” (cf. Diessel 1999:39).",
381,"{""vdoc"": ""0==0||1==1||2==2||3==3||4==4||5==5||N/A==not applicable""}",NP305,How many distance contrasts do adnominal demonstratives encode?,,
382,"{""vdoc"": ""1==yes||0==no||N/A==not applicable i.e. referring to 'adnominal' demonstratives - not to the semantic feature encoded""}",NP306,Can adnominal demonstratives encode visibility?,"encoded, not implied",
383,"{""vdoc"": ""1==yes||0==no||N/A==not applicable referring to 'adnominal' demonstratives - not to the semantic feature encoded""}",NP307,Can adnominal demonstratives encode altitude?,e.g. below/lower S,
384,"{""vdoc"": ""1==yes||0==no||N/A==not applicable i.e. referring to 'adnominal' demonstratives - not to the semantic feature encoded""}",NP308,Can adnominal demonstratives encode position of the referent in space or posture?,"e.g. seated, standing, hanging",
385,"{""vdoc"": ""1==yes||0==no||N/A==not applicable i.e. referring to 'adnominal' demonstratives - not to the semantic feature encoded""}",NP309,Can adnominal demonstratives encode movement?,"e.g. moving towards S, away from S",
386,"{""vdoc"": ""0==No||1==Yes""}",ARW4-2a-03,Is there a morphologically marked inverse?,"i.e. different marking by verbal affixation or pronominal clitics referring to A and O, depending on person, animacy or definiteness",
387,"{""vdoc"": ""A==obligatory only on human nouns||B==obligatory only on animates (i.e. humans and non-human animates)||C==optional on all nouns||D==obligatory on all nouns""}",NP711,What is the occurrence of nominal plural? (in the NP without a modifying numeral),,
388,"{""vdoc"": ""A==no plural marking||B==marked by a prefix/proclitic||C==marked by a suffix||D==marked by an enclitic||E==marked by a free (not bound) marker||F==by referential elements""}",NP710,Do nouns have a morphologically marked singular vs. plural distinction?,"Indicate the primary method of plurality coding. By 'primary' a method is meant which is used for by at least twice as many nouns as any other method (cf. Dryer, WALS, feature 33)",
389,"{""vdoc"": ""A==prefix/proclitic||B==suffix/enclitic||C==variable||D==none""}",ARGEX2-4,Person can be marked for A,,
390,"{""vdoc"": ""0==No||1==Yes""}",ARW70,Is there a plural suffix similar to -pe,,
391,"{""vdoc"": ""0==No||1==Yes""}",ARW71,Are there any suppletive forms for number?,,
392,"{""vdoc"": ""0==No||1==Yes""}",ARW72,Are there any suppletive forms disinguished only by possessability?,,
393,"{""vdoc"": ""0==No||1==Yes""}",ARW73,Are there locative classifiers?,,
394,"{""vdoc"": ""N==no||AFF==affix||CLI==clitic||PAR==particle||AUX==auxiliary||STEM==stem change/ suppletion||?==unknown""}",TAME2-15,Is desiderative marked morpho-syntactically?,The wish or desire to do sth,
395,"{""vdoc"": ""N==no||AFF==affix||CLI==clitic||PAR==particle||AUX==auxiliary||STEM==stem change/ suppletion||?==unknown""}",TAME2-14,Is purposive marked morpho-syntactically?,in order to...,
396,"{""vdoc"": ""N==no||AFF==affix||CLI==clitic||PAR==particle||AUX==auxiliary||STEM==stem change/ suppletion||?==unknown""}",TAME2-13,Is frustrative marked morpho-syntactically?,i.e. an event that has not come true  and/or an event that has not brought satisfying results,
397,"{""vdoc"": ""N==no||AFF==affix||CLI==clitic||PAR==particle||AUX==auxiliary||STEM==stem change/ suppletion||?==unknown""}",TAME2-12,Is dubitative marked morpho-syntactically?,"uncertainty, doubt, speculation (opposite of certainty)",
398,"{""vdoc"": ""N==no||AFF==affix||CLI==clitic||PAR==particle||AUX==auxiliary||STEM==stem change/ suppletion||?==unknown""}",TAME2-11,Is certainty marked morpho-syntactically?,opposite of dubitative,
399,"{""vdoc"": ""N==no||AFF==affix||CLI==clitic||PAR==particle||AUX==auxiliary||STEM==stem change/ suppletion||?==unknown""}",TAME2-10,Is there a potential modal marker expressing a potential reality (but not necessarily excluding past reference)?,,
400,"{""vdoc"": ""0==No||1==Yes""}",ARW2-1-03a,Are there prenominal articles?,,
401,"{""vdoc"": ""0==No||1==Yes""}",ARW2-1-03b,Are there postnominal articles?,,
402,"{""vdoc"": ""0==No||1==Yes""}",ARW4-3-09b,Are there complement clauses for perception verbs?,,
403,"{""vdoc"": ""0==No||1==Yes""}",ARW4-3-09c,Is there a complementizer that precedes a complement clause?,,
404,"{""vdoc"": ""0==No||1==Yes""}",ARW4-3-09a,Are there complement clauses for speech verbs?,,
405,"{""vdoc"": ""0==No||1==Yes""}",ARW2-6-08,Can possession be marked on the nominal possessee?,,
406,"{""vdoc"": ""0==No||1==Yes""}",ARW4-3-09d,Is there a complementizer that follows a complement clause?,,
407,"{""vdoc"": ""0==No||1==Yes""}",ARW2-6-05,Can possession be marked by a prefix?,even if only on a restricted number of kin terms; emphasis is on can.,
408,"{""vdoc"": ""0==No||1==Yes""}",ARW2-6-07,Can possession be marked on the nominal possessor?,,
409,"{""vdoc"": ""0==No||1==Yes""}",ARW2-6-06,Can possession be marked by a suffix?,even if only on a restricted number of kin terms; emphasis is on can.,
523,"{""vdoc"": ""0==No||1==Yes""}",ARW4-1-09,Is there a difference between imperative and declarative negation?,,
414,"{""vdoc"": ""0==absent||1==-sapa||2==-pa:ku||3==-ri/-rka||4==-naku||5==-kuna||6==-ku||7==different""}",AND25,What is the form of the verbal plural marker?,,
415,"{""vdoc"": ""1==-nuy/-naw||2==-hina""}",AND26,What is the form of the 'equational' marker,,
416,"{""vdoc"": ""1==-:||2==-ni||3==-y""}",AND20,What is the form of 1sgSU Main Tense?,,
417,"{""vdoc"": ""1==-rqayki||2==-rqanki""}",AND21,What is the form of 2SGPAST,,
418,"{""vdoc"": ""1==-ma||2==-wa""}",AND22,What is the form of 1sgOB?,,
419,"{""vdoc"": ""1==-sur(q)anki||2==-r(q)asunki||3==none""}",AND23,What is the form of 3sg>2sgPAST?,,
420,"{""vdoc"": ""0==No||1==Yes""}",ARW4-4-01,Are causatives formed by serial verb constructions?,,
421,"{""vdoc"": ""0==No||1==Yes""}",ARW4-4-03,Are causatives formed by constructions involving 'say'?,,
422,"{""vdoc"": ""0==No||1==Yes""}",ARW4-4-02,Are causatives formed by bound affixes/clitics?,,
423,"{""vdoc"": ""A==independent prefix/proclitic||B==independent suffix/enclitic||C==fused with person||D==none""}",ARGEX2-8,Number can be marked for P,,
424,"{""vdoc"": ""A==independent prefix/proclitic||B==independent suffix/enclitic||C==fused with person||D==none||E==no gender""}",ARGEX2-9,Gender can be marked for P,,
425,"{""vdoc"": ""0==No||1==Yes""}",ARW3-3-23,"Are person, number and any TAM category (i.e. 3 or more categories in all) marked by portmanteau morphemes on verbs?",The questions 3.3.23ff imply 'do they ever'?,
426,"{""vdoc"": ""0==No||1==Yes""}",ARW3-3-22,Is number ever marked separately from person on the verb?,,
427,"{""vdoc"": ""0==No||1==Yes""}",ARW3-3-21,Do verb stems alter according to the person of a core participant?,,
428,"{""vdoc"": ""0==No||1==Yes""}",ARW3-3-24,"Are categories such as person, number, gender related to a single participant discontinuously marked on a verb?",,
429,"{""vdoc"": ""A==obligatory||B==variable||C==not expressed""}",ARGEX2-1-1,Verbal person markings for S when lexical argument is realized within clause are,,
430,"{""vdoc"": ""0==No||1==Yes""}",ICS15,Does the language mark past tense?,"Corresponds to WALS feature number: 66 [http://wals.info], Constenla feature number: na [Constenla Umaña, Adolfo. (1991) Las lenguas del área intermedia: introducción a su estudio areal. San José: Universidad de Costa Rica.]",
431,"{""vdoc"": ""0==No||1==Yes""}",ICS14,Is there a morpheme that marks genitive case in alienable posession?,"Corresponds to WALS feature number: 58 [http://wals.info], Constenla feature number: 23 [Constenla Umaña, Adolfo. (1991) Las lenguas del área intermedia: introducción a su estudio areal. San José: Universidad de Costa Rica.]",
432,"{""vdoc"": ""0==No||1==Yes""}",ICS17,Are there suffixes to indicate tense or aspect?,"Corresponds to WALS feature number: 69 [http://wals.info], Constenla feature number: 38 [Constenla Umaña, Adolfo. (1991) Las lenguas del área intermedia: introducción a su estudio areal. San José: Universidad de Costa Rica.]",
433,"{""vdoc"": ""0==No||1==Yes""}",ICS16,Are there prefixes to indicate tense or aspect?,"Corresponds to WALS feature number: 69 [http://wals.info], Constenla feature number: 37 [Constenla Umaña, Adolfo. (1991) Las lenguas del área intermedia: introducción a su estudio areal. San José: Universidad de Costa Rica.]",
434,"{""vdoc"": ""0==No||1==Yes""}",ICS11,Does the language have pronominal possessive prefixes?,"Corresponds to WALS feature number: 57 [http://wals.info], Constenla feature number: na [Constenla Umaña, Adolfo. (1991) Las lenguas del área intermedia: introducción a su estudio areal. San José: Universidad de Costa Rica.]",
435,"{""vdoc"": ""0==No||1==Yes""}",ICS10,Are there numeral classifiers? [ICS10],"Corresponds to WALS feature number: 55 [http://wals.info], Constenla feature number: 41 [Constenla Umaña, Adolfo. (1991) Las lenguas del área intermedia: introducción a su estudio areal. San José: Universidad de Costa Rica.]",
436,"{""vdoc"": ""0==No||1==Yes""}",ICS13,Is there a morpheme that marks genitive case in inalienable posession?,"Corresponds to WALS feature number: 58 [http://wals.info], Constenla feature number: 22 [Constenla Umaña, Adolfo. (1991) Las lenguas del área intermedia: introducción a su estudio areal. San José: Universidad de Costa Rica.]",
437,"{""vdoc"": ""0==No||1==Yes""}",ICS12,Does the language have pronominal possessive suffixes?,"Corresponds to WALS feature number: 57 [http://wals.info], Constenla feature number: na [Constenla Umaña, Adolfo. (1991) Las lenguas del área intermedia: introducción a su estudio areal. San José: Universidad de Costa Rica.]",
438,"{""vdoc"": ""1==true||0==false""}",ARGEX7-1-3,Applicative constructions can be derived from transitive verbs,,
439,"{""vdoc"": ""0==No||1==Yes""}",ICS19,Is there VS (verb-agent) order in transitive clauses?,"Corresponds to WALS feature number: 82 [http://wals.info], Constenla feature number: 2 [Constenla Umaña, Adolfo. (1991) Las lenguas del área intermedia: introducción a su estudio areal. San José: Universidad de Costa Rica.]",
440,"{""vdoc"": ""0==No||1==Yes""}",ICS18,Is there VO order in transitive clauses?,"Corresponds to WALS feature number: 83 [http://wals.info], Constenla feature number: 1 [Constenla Umaña, Adolfo. (1991) Las lenguas del área intermedia: introducción a su estudio areal. San José: Universidad de Costa Rica.]",
441,"{""vdoc"": ""A==prefix/proclitic||B==suffix/enclitic||C==variable||D==none""}",ARGEX2-7,Person can be marked for P,,
442,"{""vdoc"": ""A==prefix/proclitic||B==suffix/enclitic||C==variable||D==none""}",ARGEX2-1,Person can be marked for S,,
443,"{""vdoc"": ""A==independent prefix/proclitic||B==independent suffix/enclitic||C==fused with person||D==none""}",ARGEX2-2,Number can be marked for S,,
519,"{""vdoc"": ""0==No||1==Yes""}",ARW4-1-03,Is a pragmatically unmarked constituent order verb-initial for transitive clauses?,,
444,"{""vdoc"": ""A==independent prefix/proclitic||B==independent suffix/enclitic||C==fused with person||D==none||E==no gender""}",ARGEX2-3,Gender can be marked for S,,
445,"{""vdoc"": ""0==No||1==Yes""}",ARW4-3-08,Are there temporal non-finite subordinate clauses?,,
446,"{""vdoc"": ""A==prefix/proclitic||B==suffix/enclitic||C==none""}",ARGEX5-2,A is case-marked,,
447,"{""vdoc"": ""A==prefix/proclitic||B==suffix/enclitic||C==none""}",ARGEX5-1,S is case-marked,,
448,"{""vdoc"": ""1==-y||2==-na""}",AND9,Infinitival complements (Action nominals) are marked with (type mikhuyta/mikunata munani),,
449,"{""vdoc"": ""0==absent||1==-y||2==-yni||3==-ni""}",AND8,What is the form of 1SG possessive,,
450,"{""vdoc"": ""1==identical||2==different""}",AND5,Is the form of the genitive and the benefactive identical (-paq) or different (-pa/-paq)?,,
451,"{""vdoc"": ""0==no||1==yes""}",AND4,Is the 'Additional' suffix found in concessive adverbial clauses?,,
452,"{""vdoc"": ""1==-chaw/-chu||2==pi||3==-pa""}",AND7,What is the form of the locative?,,
453,"{""vdoc"": ""1==-pi(q)ta||2==-manta||3==-paq""}",AND6,What is the form of the ablative?,,
454,"{""vdoc"": ""1==-kuna||2==-zhapa""}",AND1,What is the nominal plural marker?,,
455,"{""vdoc"": ""1==-ta||2==-pa""}",AND3,Adverbs derived from infinitival forms are marked with,,
456,"{""vdoc"": ""1==\u00f1oqayku||2==\u00f1oqa-kuna||3==\u00f1oqa-sapa||4==there is no disticntion""}",AND2,What is the pronoun that expresses 1PLEXCL,,
457,"{""vdoc"": ""1==true||0==false""}",ARGEX12-1-1,The marking of anticausative constructions is conflated with the marking of reciprocal and/or reflexive constructions,,
458,"{""vdoc"": ""0==No||1==Yes""}",ARW2-5-01a,"If there are noun classes/genders, state how many",i.e. if the answer to 2.5.01 is YES,
459,"{""vdoc"": ""0==No||1==Yes""}",ARW4-3-02,Is there a morphologically-marked switch reference system?,,
460,"{""vdoc"": ""0==No||1==Yes""}",ARW4-3-03,Is there a morphologically marked distinction between simultaneous and sequential clauses?,,
461,"{""vdoc"": ""N==no||AFF==affix||CLI==clitic||PAR==particle||AUX==auxiliary||STEM==stem change/ suppletion||?==unknown""}",TAME1-1,Is present tense marked morpho-syntactically?,,
462,"{""vdoc"": ""N==no||AFF==affix||CLI==clitic||PAR==particle||AUX==auxiliary||STEM==stem change/ suppletion||?==unknown""}",TAME1-2,Is future tense marked morpho-syntactically?,future expressed by tense rather than mood or aspect; prediction,
463,"{""vdoc"": ""Y==yes||N==no||?==not known""}",FFQ17,"Accusative alignment in simple clauses (by word order, verbal marking or case marking`with no major conflicting signals)",split system = N,
464,"{""vdoc"": ""Y==yes||N==no||?==not known""}",FFQ16,"Core case (i.e. case marker for nominative, accusative, ergative, absolutive)",,
465,"{""vdoc"": ""A==small (0-4)||B==medium (5-6)||C==large (7 and higher)""}",FFQ15,Elaborate case marking system (phonologically dependent elements),,
466,"{""vdoc"": ""N==no||AFF==affix||CLI==clitic||PAR==particle||AUX==auxiliary||STEM==stem change/ suppletion||?==unknown""}",TAME1-3,Is past tense marked morpho-syntactically?,i.e. a past marker of any remoteness value,
467,"{""vdoc"": ""Y==yes||N==no||?==not known""}",FFQ13,Prefixes (specify whether this includes person prefixes),,
468,"{""vdoc"": ""Y==yes||N==no||?==not known""}",FFQ12,Aspirated stops (phonemic),,
469,"{""vdoc"": ""Y==yes||N==no||?==not known""}",FFQ11,Glottalized stops (phonemic),,
470,"{""vdoc"": ""Y==yes||N==no||?==not known""}",FFQ10,Nasal spread,,
471,"{""vdoc"": ""1==true||0==false""}",ARGEX3-1-1,A distinct morpheme marks the inverse construction on the verb,,
472,"{""vdoc"": ""Y==yes||N==no||?==not known""}",FFQ19,Classifier or gender systems,"> 1 marked class, beyond pronouns",
473,"{""vdoc"": ""Y==yes||N==no||?==not known""}",FFQ18,Dependent marking for possession (beyond pronouns),,
474,"{""vdoc"": ""0==No||1==Yes""}",ARW38,There is an impersonal/unspecified prefix/proclitic for verbs,,
475,"{""vdoc"": ""0==No||1==Yes""}",ARW39,The personal prefix/proclitic 1SG is ni-/no-,,
476,"{""vdoc"": ""1==true||0==false""}",ARGEX3-1-3,Inverse constructions can be used to distinguish between third person participants,,
477,"{""vdoc"": ""0==No||1==Yes""}",ARW30,Adjectives are noun-like,,
478,"{""vdoc"": ""0==No||1==Yes""}",ARW31,Adjectives are like stative verbs,,
479,"{""vdoc"": ""0==No||1==Yes""}",ARW32,The possessor is marked by a personal prefix/proclitic on the possessed noun,,
480,"{""vdoc"": ""0==No||1==Yes""}",ARW33,The order of NPs is possessor-possessed,,
481,"{""vdoc"": ""0==No||1==Yes""}",ARW34,The order of NPs is possessed-possessor,,
482,"{""vdoc"": ""0==No||1==Yes""}",ARW35,The possessor marking is the same personal prefix/proclitic as S/A on verbs,,
483,"{""vdoc"": ""0==No||1==Yes""}",ARW36,There is an impersonal/unspecified possessor prefix/proclitic for nouns,,
484,"{""vdoc"": ""0==No||1==Yes""}",ARW37,There is an impersonal/unspecified possessor suffix/enclitic for nouns,,
520,"{""vdoc"": ""0==No||1==Yes""}",ARW4-1-01,Is a pragmatically unmarked constituent order SV for intransitive clauses?,,
485,"{""vdoc"": ""A==dem-N||B==N-dem||C==both orders with neither order dominant||D==both but for specific forms||E==both but depend on the characteristics of the nominal head||F==neither - demonstratives are not used adnominally||N/A==not applicable""}",NP110,What is the most frequent order of demonstrative and noun?,,
486,"{""vdoc"": ""A==adjectives||B==verbs||C==nouns||D==some numerals are nouns and some are verbs||E==adverbs||F==not applicable""}",NP610,Which class do native numerals belong to?,"By 'native numerals' are meant numerals not borrowed from Spanish or Portuguese, or other dominant language.",
487,"{""vdoc"": ""1==yes||0==no||N/A==not applicable""}",NP230,Is there agreement between demonstrative/determiner and the noun in the NP?,,
488,"{""vdoc"": ""1==yes||0==no||N/A==not applicable""}",NP231,Is there agreement in NUMBER between demonstrative and noun?,,
489,"{""vdoc"": ""1==yes||0==no||N/A==not applicable""}",NP232,Is there agreement in GENDER between demonstrative and noun?,,
490,"{""vdoc"": ""1==yes||0==no||N/A==not applicable""}",NP233,Is there agreement in PHYSICAL PROPERTIES between demonstrative and noun?,,
491,"{""vdoc"": ""0==No||1==Yes""}",ARW1-1-09,Is there a voicing contrast between oral (i.e. non-prenasal) stops?,,
492,"{""vdoc"": ""0==No||1==Yes""}",ARW1-1-08,Is there a phonemic velar fricative or glide?,,
493,"{""vdoc"": ""0==No||1==Yes""}",ICU28,Is there inflectional marking of a future/non-future distinction?,"Corresponds to WALS feature number: 67 [http://wals.info], Constenla feature number: na [Constenla Umaña, Adolfo. (1991) Las lenguas del área intermedia: introducción a su estudio areal. San José: Universidad de Costa Rica.]",
494,"{""vdoc"": ""0==No||1==Yes""}",ICU29,Does the language mark a perfective/imperfective distinction?,"Corresponds to WALS feature number: 65 [http://wals.info], Constenla feature number: na [Constenla Umaña, Adolfo. (1991) Las lenguas del área intermedia: introducción a su estudio areal. San José: Universidad de Costa Rica.]",
495,"{""vdoc"": ""0==No||1==Yes""}",ICU22,Is the indefinite article the same as 'one'?,"Corresponds to WALS feature number: 38 [http://wals.info], Constenla feature number: na [Constenla Umaña, Adolfo. (1991) Las lenguas del área intermedia: introducción a su estudio areal. San José: Universidad de Costa Rica.]",
496,"{""vdoc"": ""0==No||1==Yes""}",ICU23,Is the indefinite article distinct from 'one'?,"Corresponds to WALS feature number: 38 [http://wals.info], Constenla feature number: na [Constenla Umaña, Adolfo. (1991) Las lenguas del área intermedia: introducción a su estudio areal. San José: Universidad de Costa Rica.]",
497,"{""vdoc"": ""0==No||1==Yes""}",ICU20,Are pronominal subjects verbal affixes?,"Corresponds to WALS feature number: 101 [http://wals.info], Constenla feature number: na [Constenla Umaña, Adolfo. (1991) Las lenguas del área intermedia: introducción a su estudio areal. San José: Universidad de Costa Rica.]",
498,"{""vdoc"": ""0==No||1==Yes""}",ICU21,Are pronominal subjects clitics on a variable host?,"Corresponds to WALS feature number: 101 [http://wals.info], Constenla feature number: na [Constenla Umaña, Adolfo. (1991) Las lenguas del área intermedia: introducción a su estudio areal. San José: Universidad de Costa Rica.]",
499,"{""vdoc"": ""0==No||1==Yes""}",ARW1-1-05,Are there fricative phonemes?,,
500,"{""vdoc"": ""0==No||1==Yes""}",ICU27,Are nominal and verbal conjunction expressed with the same marker?,"Corresponds to WALS feature number: 64 [http://wals.info], Constenla feature number: na [Constenla Umaña, Adolfo. (1991) Las lenguas del área intermedia: introducción a su estudio areal. San José: Universidad de Costa Rica.]",
501,"{""vdoc"": ""0==No||1==Yes""}",ARW1-1-07,Is there a phonemic distinction between l/r?,,
502,"{""vdoc"": ""0==No||1==Yes""}",ARW1-1-06,Are there phonemic prenasalised stops?,,
503,"{""vdoc"": ""0==No||1==Yes""}",ARW2-2-03a,Is there a dual (or unit augmented) in addition to a plural (or augmented) number category in pronouns?,,
504,"{""vdoc"": ""0==No||1==Yes""}",ARW49,The personal suffix/enclitic 1SG is -ni/-no,,
505,"{""vdoc"": ""0==No||1==Yes""}",ARW48,3PL is no-/na-,,
506,"{""vdoc"": ""0==No||1==Yes""}",ARW45,3SGf is ri- or (l)i-,,
507,"{""vdoc"": ""0==No||1==Yes""}",ARW44,3SGm is ro- or (l)o-,,
508,"{""vdoc"": ""0==No||1==Yes""}",ARW47,2PL is (y)i-/hi-,,
509,"{""vdoc"": ""0==No||1==Yes""}",ARW46,1PL is vi-/wa-,,
510,"{""vdoc"": ""0==No||1==Yes""}",ARW41,2SG is pi-/bi-,,
511,"{""vdoc"": ""0==No||1==Yes""}",ARW40,The personal prefix/proclitic 1SG is ta-/da-,,
512,"{""vdoc"": ""0==No||1==Yes""}",ARW43,3SGm is ri- or (l)i-,,
513,"{""vdoc"": ""0==No||1==Yes""}",ARW42,3SGf is ro- or (l)o-,,
514,"{""vdoc"": ""0==No||1==Yes""}",ARW4-1-06,Is constituent order fixed?,"Do not consider 'left or right-dislocation', accompanied by intonational signals",
515,"{""vdoc"": ""0==No||1==Yes""}",ARW4-1-07,Can negation be marked clause-finally?,This includes suffixes on verb-final clauses; prefixes on clause-final verbs do not count; Don't include elliptical 'Pete didn't',
516,"{""vdoc"": ""0==No||1==Yes""}",ARW4-1-04,Is a pragmatically unmarked constituent order verb-medial for transitive clauses?,,
517,"{""vdoc"": ""0==No||1==Yes""}",ARW4-1-05,Is a pragmatically unmarked constituent order verb-final for transitive clauses?,,
518,"{""vdoc"": ""0==No||1==Yes""}",ARW4-1-02,Is a pragmatically unmarked constituent order VS for intransitive clauses?,,
521,"{""vdoc"": ""A==prefix/proclitic||B==suffix/enclitic||C==none""}",ARGEX5-3,P is case-marked,,
524,"{""vdoc"": ""0==No||1==Yes""}",ARW3-5-02,Is gender marked anywhere separately to person?,,
525,"{""vdoc"": ""0==No||1==Yes""}",ARW3-5-04,Is negation marked morphologically on the verbs?,"i.e. affixation, stem alternation, neutralization of some inflection",
526,"{""vdoc"": ""1==yes||0==no""}",NP11,Is nominalization the main strategy for adverbial clause formation?,"e.g. 'When I arrived in Q, I saw a friend', or 'Because my brother came, we gave a big party'.",
527,"{""vdoc"": ""1==yes||0==no""}",NP10,Is nominalization the main strategy for attributive (relative) clause formation?,e.g. 'We see the dog that usually bites'='We see the usually biting dog',
528,"{""vdoc"": ""1==interrogative-based indefinites (please mark if an element meaning 'also'is added)||2==Generic-noun-based indefinites||3==special indefinites||4==mixed indefinites||5==existential constructions""}",NP13,In what way are indefinite pronouns realized?,,
529,"{""vdoc"": ""1==yes||0==no""}",NP12,Is nominalization the main strategy for complement clause formation?,e.g. 'We know that he drinks too much'= 'We know [his drinking too much]',
530,"{""vdoc"": ""1==-yka||2==-chka||3==-ku (or reflexes)""}",AND19,What is the form for the Durative marker,,
531,"{""vdoc"": ""1==-nchikman||2==-chwan||3==both""}",AND18,What is the form for the potential 1PLINCL,,
532,"{""vdoc"": ""0==no||1==yes""}",AND15,Does the language has productive gerund marked with -stin,,
533,"{""vdoc"": ""0==no||1==yes""}",AND14,Are there other switch reference markers than -spa/-r and -qti/-kpi (extended system),,
534,"{""vdoc"": ""1==-ykiman/ -nkiman; ||2==-waq||3==both""}",AND17,What is the form for the potential 2SG,,
535,"{""vdoc"": ""1==-\u00f1aq||2==shqa""}",AND16,What is the form for the narrative?,,
536,"{""vdoc"": ""1==-na-chi-||2==na-ka-chi-""}",AND11,What is the form of the reciprocal causative,,
537,"{""vdoc"": ""1==-ku||2==-ri""}",AND10,What is the form of the reflexive marker?,,
538,"{""vdoc"": ""1==-qti||2==-kpi""}",AND13,Is DS marked with -qti (1) or -kpi (2),,
539,"{""vdoc"": ""1==-spa||2==-r||3==both""}",AND12,Is SS marked with -spa (1)  or -r (2),,
540,"{""vdoc"": ""1==true||0==false""}",ARGEX7-1-4,Introduced arguments can be included as obliques in non-derived clauses,,
541,"{""vdoc"": ""0==No||1==Yes""}",ARW2-8-01b,"Do core adjectives (defined semantically as property concepts; value, shape, age, dimension) used attributively require the same morphological treatment as verbs?",,
542,"{""vdoc"": ""0==No||1==Yes""}",ARW2-8-01a,"Do core adjectives (defined semantically as property concepts; value, shape, age, dimension) act like verbs in predicative position?",,
543,"{""vdoc"": ""0==No||1==Yes""}",ARW3-5-05a,Can locative or direction be morphologically marked on the verb?,Locative as Direct Object ('she sleeps mat') does not qualify,
